{
  "id": "school-common",
  "scope": "school",
  "version": 1,
  "note": "학교 공용 허용목록 초안. 설계서 12장 '오탐 코퍼스'에서 나온다. signer 값은 이름 문자열이라 위장 가능성이 있으므로 초안일 뿐이고, 실기기에서 수집한 sha256/teamId로 좁혀 확정한다 — `ExamCheck --emit-allowlist` 가 그 초안을 만들어 준다.",
  "comments": [
    "여기부터는 실기기 오탐 코퍼스(ExamCheck --emit-allowlist)에서 나온 국내 기관용 PKI·보안 스택. 대학·공공 포털이 설치하므로 국내 학생 노트북 대부분에 상주하고, 전부 창 없이 도는 에이전트형이라 S1·S2 를 그대로 때린다. 서명 검증된 인증서 주체만 담았다.",
    "같은 코퍼스에서 나왔지만 일부러 허용목록에 넣지 않은 것들 — Anthropic PBC(AI 어시스턴트), Riot Games(게임 클라이언트), Ollama·Python(미서명 로컬 실행 환경), Wondershare. 시험에서는 이것들이 잡히는 게 맞다. 허용목록은 '오탐을 줄이는 도구'이지 '조용하게 만드는 도구'가 아니다.",
    "RaonSecure WAClientNx/WAClientTray, Wizvera veraport 는 이 기기에서 서명이 검증되지 않았다. 미서명 바이너리는 경로로만 허용할 수 있고 그건 위장에 약하므로, 학교가 배포한 버전의 sha256 을 확인해 해시로 거는 것이 맞다."
  ],
  "allow": [
    {
      "signer": "Microsoft Windows*",
      "platform": "windows",
      "layer": "os",
      "note": "OS 기본. platformBinary 검사와 함께 적용된다."
    },
    {
      "signer": "Microsoft Corporation*",
      "platform": "windows",
      "layer": "os",
      "note": "OS 기본"
    },
    {
      "signer": "Microsoft Windows Hardware Compatibility Publisher*",
      "platform": "windows",
      "layer": "os"
    },
    {
      "teamId": "",
      "signer": "Software Signing",
      "platform": "macos",
      "layer": "os",
      "note": "Apple 플랫폼 바이너리"
    },
    {
      "signer": "Dropbox, Inc*",
      "platform": "any",
      "layer": "school",
      "note": "미검증 — 실기기 확인 필요"
    },
    {
      "signer": "Microsoft Corporation*",
      "platform": "any",
      "layer": "school",
      "note": "OneDrive · Teams · Edge"
    },
    {
      "signer": "Google LLC*",
      "platform": "any",
      "layer": "school",
      "note": "Chrome · Drive"
    },
    {
      "signer": "Kakao Corp*",
      "platform": "any",
      "layer": "school",
      "note": "카카오톡 — 국내 시험장 최대 오탐원"
    },
    {
      "signer": "NAVER Corp*",
      "platform": "any",
      "layer": "school",
      "note": "Whale · 클라우드"
    },
    {
      "signer": "Discord Inc*",
      "platform": "any",
      "layer": "school"
    },
    {
      "signer": "Notion Labs, Inc*",
      "platform": "any",
      "layer": "school"
    },
    {
      "signer": "Slack Technologies*",
      "platform": "any",
      "layer": "school"
    },
    {
      "signer": "AgileBits Inc*",
      "platform": "any",
      "layer": "school",
      "note": "1Password — S3 캡처 제외 창의 정상 사례"
    },
    {
      "signer": "Bitwarden Inc*",
      "platform": "any",
      "layer": "school",
      "note": "S3 정상 사례"
    },
    {
      "signer": "Hancom Inc*",
      "platform": "windows",
      "layer": "school",
      "note": "한컴오피스 · 입력기"
    },
    {
      "signer": "AhnLab, Inc*",
      "platform": "windows",
      "layer": "school",
      "note": "백신"
    },
    {
      "signer": "ESTsecurity Corp*",
      "platform": "windows",
      "layer": "school",
      "note": "알약"
    },
    {
      "signer": "Symantec*",
      "platform": "windows",
      "layer": "school",
      "note": "백신"
    },
    {
      "signer": "McAfee*",
      "platform": "windows",
      "layer": "school",
      "note": "백신"
    },
    {
      "signer": "CrowdStrike, Inc*",
      "platform": "windows",
      "layer": "school",
      "note": "EDR"
    },
    {
      "signer": "Intel Corporation*",
      "platform": "windows",
      "layer": "school",
      "note": "그래픽·무선 드라이버 상주"
    },
    {
      "signer": "NVIDIA Corporation*",
      "platform": "windows",
      "layer": "school"
    },
    {
      "signer": "Realtek Semiconductor Corp*",
      "platform": "windows",
      "layer": "school",
      "note": "오디오 트레이"
    },
    {
      "signer": "Synaptics Incorporated*",
      "platform": "windows",
      "layer": "school",
      "note": "터치패드 트레이"
    },
    {
      "signer": "Lenovo*",
      "platform": "windows",
      "layer": "school",
      "note": "제조사 유틸"
    },
    {
      "signer": "Samsung Electronics*",
      "platform": "windows",
      "layer": "school",
      "note": "제조사 유틸"
    },
    {
      "signer": "LG Electronics*",
      "platform": "windows",
      "layer": "school"
    },
    {
      "signer": "Dell Inc*",
      "platform": "windows",
      "layer": "school"
    },
    {
      "signer": "ASUSTeK Computer Inc*",
      "platform": "windows",
      "layer": "school"
    },
    {
      "signer": "Logitech*",
      "platform": "windows",
      "layer": "school",
      "note": "입력장치 유틸 — S12 HID 오픈의 정상 사례"
    },
    {
      "signer": "Razer Inc*",
      "platform": "windows",
      "layer": "school",
      "note": "게이밍 키보드 유틸 — S12 정상 사례"
    },
    {
      "signer": "Corsair Memory, Inc*",
      "platform": "windows",
      "layer": "school",
      "note": "S12 정상 사례"
    },
    {
      "signer": "Zoom Video Communications, Inc*",
      "platform": "any",
      "layer": "school",
      "note": "S11 캡처 스택의 정상 사례"
    },
    {
      "signer": "Cisco Systems, Inc*",
      "platform": "any",
      "layer": "school",
      "note": "Webex — S11 정상 사례"
    },
    {
      "signer": "OBS Studio Contributors*",
      "platform": "any",
      "layer": "course",
      "note": "미디어 수업에서만. 일반 시험에서는 제외."
    },
    {
      "signer": "INITECH Co., Ltd*",
      "platform": "windows",
      "layer": "school",
      "note": "INISAFE Web EX Client"
    },
    {
      "signer": "Dream Security Co.,Ltd*",
      "platform": "windows",
      "layer": "school",
      "note": "MagicLine4NX"
    },
    {
      "signer": "RAONWIZ Inc*",
      "platform": "windows",
      "layer": "school",
      "note": "RAON K"
    },
    {
      "signer": "MarkAny Inc*",
      "platform": "windows",
      "layer": "school",
      "note": "EPSBroker"
    },
    {
      "signer": "CROSSCERT, INC*",
      "platform": "windows",
      "layer": "school",
      "note": "UniSignCRSV3"
    },
    {
      "signer": "KOSCOM CORP*",
      "platform": "windows",
      "layer": "school",
      "note": "SignKorea 인증서 서비스"
    },
    {
      "signer": "Interezen. Co.,Ltd*",
      "platform": "windows",
      "layer": "school",
      "note": "IPinside LWS"
    },
    {
      "signer": "Kings Information & Network Co.,Ltd*",
      "platform": "windows",
      "layer": "school",
      "note": "Kings Online Security"
    },
    {
      "signer": "HANCOM WITH Inc*",
      "platform": "windows",
      "layer": "school",
      "note": "AnySign4PC"
    },
    {
      "signer": "ClipSoft Co.,Ltd*",
      "platform": "windows",
      "layer": "school",
      "note": "Rexpert 인쇄 서비스"
    },
    {
      "signer": "Oracle America, Inc*",
      "platform": "windows",
      "layer": "school",
      "note": "Java Update 상주"
    },
    {
      "signer": "Microsoft Windows Publisher*",
      "platform": "windows",
      "layer": "os",
      "note": "OS 구성 요소"
    },
    {
      "teamId": "G7HH3F8CAK",
      "platform": "macos",
      "layer": "school",
      "note": "미검증 자리표시 — Raycast. 실기기에서 확인 후 교체"
    },
    {
      "signer": "Developer ID Application: Karabiner*",
      "platform": "macos",
      "layer": "school",
      "note": "Karabiner-Elements — S4·S12 정상 사례. 미검증"
    },
    {
      "signer": "Developer ID Application: Bartender*",
      "platform": "macos",
      "layer": "school",
      "note": "S2 정상 사례. 미검증"
    },
    {
      "signer": "Developer ID Application: Running with Crayons*",
      "platform": "macos",
      "layer": "school",
      "note": "Alfred. 미검증"
    }
  ],
  "deny": [
    {
      "id": "remote-anydesk",
      "signal": "S6",
      "match": {
        "nameContains": "anydesk"
      },
      "note": "원격제어"
    },
    {
      "id": "remote-teamviewer",
      "signal": "S6",
      "match": {
        "nameContains": "teamviewer"
      },
      "note": "원격제어"
    },
    {
      "id": "remote-rustdesk",
      "signal": "S6",
      "match": {
        "nameContains": "rustdesk"
      },
      "note": "원격제어"
    },
    {
      "id": "remote-vnc",
      "signal": "S6",
      "match": {
        "nameContains": "vnc"
      },
      "note": "VNC 계열"
    },
    {
      "id": "remote-chromerd",
      "signal": "S6",
      "match": {
        "nameContains": "remoting_host"
      },
      "note": "Chrome 원격 데스크톱"
    },
    {
      "id": "remote-parsec",
      "signal": "S6",
      "match": {
        "nameContains": "parsec"
      },
      "note": "원격 스트리밍"
    },
    {
      "id": "remote-sunlogin",
      "signal": "S6",
      "match": {
        "nameContains": "sunlogin"
      },
      "note": "향원격제어"
    },
    {
      "id": "remote-todesk",
      "signal": "S6",
      "match": {
        "nameContains": "todesk"
      },
      "note": "원격제어"
    }
  ],
  "thresholds": {
    "capsMaxIntervalMs": 300,
    "capsMinTogglesInWindow": 2,
    "capsWindowMs": 1500,
    "debounceMs": 300000,
    "p1EscalationCount": 2,
    "heartbeatOfflineMs": 30000,
    "clockSkewToleranceMs": 30000,
    "captureGuardIntervalMs": 30000,
    "preExamContextMs": 900000
  },
  "captureStackModules": [
    "dxgi.dll",
    "d3d11.dll",
    "windows.graphics.capture.dll",
    "graphicscapture.dll",
    "dwmapi.dll",
    "ScreenCaptureKit.framework"
  ],
  "policyNotes": {
    "vmAllowed": false,
    "text": "이 시험에서는 가상머신 내 응시와 원격제어 도구 실행을 금지한다. 개발 수업 등 VM이 필요한 시험은 강의별 정책에서 vmAllowed를 켠다."
  }
}
